Key,Id,Chinese (Simplified)(zh-Hans),English (United States)(en-US),French (France)(fr-FR),German (Germany)(de-DE),Hindi (India)(hi-IN),Italian (Italy)(it-IT),Portuguese (Brazil)(pt-BR),Russian (Russia)(ru-RU),Spanish (Spain)(es-ES)
upgrade.21.title,110773923840,威士忌酸,Whiskey Sour,Whiskey Sour,Whiskey Sour,व्हिस्की सॉर,Whiskey Sour,Whiskey Sour,Виски сауэр,Whiskey Sour
upgrade.21.description,111642144768,使威士忌酸味类饮品的收益乘以{0}。,Multiplies profit from whiskey sour drinks by {0}.,Multiplie les gains des cocktails whiskey sour de {0}.,Multipliziert den Gewinn von Whiskey-Sour-Drinks um {0}.,व्हिस्की सॉर ड्रिंक्स की कमाई {0} बढ़ाता है।,Moltiplica i guadagni dei drink sour al whiskey di {0}.,Multiplica os ganhos de drinks sour com whiskey em {0}.,Умножает доход от кислых напитков с виски на {0}.,Multiplica las ganancias de drinks sour con whiskey en {0}.
upgrade.21.value,112552308736,威士忌酸味类饮品可获得{0},whiskey sour drinks earn {0},Les cocktails whiskey sour rapportent {0},Whiskey-Sour-Drinks bringen {0} ein,व्हिस्की सॉर ड्रिंक्स से {0} मिलते हैं,I drink sour al whiskey rendono {0},drinks sour com whiskey rendem {0},кислых напитков с виски приносят {0},drinks sour con whiskey generan {0}
upgrade.22.title,113416335360,帕洛玛,Paloma,Paloma,Paloma,पलोमा,Paloma,Paloma,Палома,Paloma
upgrade.22.description,114322305024,使龙舌兰西柚类饮品的收益乘以{0}。,Multiplies profit from tequila-and-grapefruit drinks by {0}.,Multiplie les gains des cocktails à la tequila et au pamplemousse de {0}.,Multipliziert den Gewinn von Tequila- und Grapefruitdrinks um {0}.,टकीला और ग्रेपफ्रूट ड्रिंक्स की कमाई {0} बढ़ाता है।,Moltiplica i guadagni dei drink a base di tequila e pompelmo di {0}.,Multiplica os ganhos de drinks de tequila e grapefruit em {0}.,Умножает доход от напитков с текилой и грейпфрутом на {0}.,Multiplica las ganancias de drinks de tequila y pomelo en {0}.
upgrade.22.value,115270217728,龙舌兰西柚类饮品可获得{0},tequila-and-grapefruit drinks earn {0},Les cocktails à la tequila et au pamplemousse rapportent {0},Tequila- und Grapefruitdrinks bringen {0} ein,टकीला और ग्रेपफ्रूट ड्रिंक्स से {0} मिलते हैं,I drink a base di tequila e pompelmo rendono {0},drinks de tequila e grapefruit rendem {0},напитков с текилой и грейпфрутом приносят {0},drinks de tequila y pomelo generan {0}
upgrade.23.title,116205547520,法式75,French 75,French 75,French 75,फ्रेंच 75,French 75,French 75,Френч 75,French 75
upgrade.23.description,117149265920,使金酒起泡类饮品的收益乘以{0}。,Multiplies profit from sparkling gin drinks by {0}.,Multiplie les gains des cocktails pétillants au gin de {0}.,Multipliziert den Gewinn von spritzige Gin-Drinks um {0}.,स्पार्कलिंग जिन ड्रिंक्स की कमाई {0} बढ़ाता है।,Moltiplica i guadagni dei drink frizzanti al gin di {0}.,Multiplica os ganhos de drinks espumantes com gin em {0}.,Умножает доход от игристых напитков с джином на {0}.,Multiplica las ganancias de drinks con ginebra y burbujas en {0}.
upgrade.23.value,118080401408,金酒起泡类饮品可获得{0},sparkling gin drinks earn {0},Les cocktails pétillants au gin rapportent {0},spritzige Gin-Drinks bringen {0} ein,स्पार्कलिंग जिन ड्रिंक्स से {0} मिलते हैं,I drink frizzanti al gin rendono {0},drinks espumantes com gin rendem {0},игристых напитков с джином приносят {0},drinks con ginebra y burbujas generan {0}
upgrade.24.title,119053479936,桑格利亚,Sangria,Sangria,Sangria,सांग्रिया,Sangria,Sangria,Сангрия,Sangría
upgrade.24.description,119967838208,使葡萄酒水果类饮品的收益乘以{0}。,Multiplies profit from wine-and-fruit drinks by {0}.,Multiplie les gains des cocktails au vin et aux fruits de {0}.,Multipliziert den Gewinn von Wein- und Fruchtdrinks um {0}.,वाइन और फल वाले ड्रिंक्स की कमाई {0} बढ़ाता है।,Moltiplica i guadagni dei drink a base di vino e frutta di {0}.,Multiplica os ganhos de drinks à base de vinho e frutas em {0}.,Умножает доход от напитков на основе вина и фруктов на {0}.,Multiplica las ganancias de drinks a base de vino y fruta en {0}.
upgrade.24.value,121607811072,葡萄酒水果类饮品可获得{0},wine-and-fruit drinks earn {0},Les cocktails au vin et aux fruits rapportent {0},Wein- und Fruchtdrinks bringen {0} ein,वाइन और फल वाले ड्रिंक्स से {0} मिलते हैं,I drink a base di vino e frutta rendono {0},drinks à base de vinho e frutas rendem {0},напитков на основе вина и фруктов приносят {0},drinks a base de vino y fruta generan {0}
upgrade.25.title,122853519360,爱尔兰咖啡,Irish Coffee,Irish Coffee,Irish Coffee,आयरिश कॉफी,Irish Coffee,Irish Coffee,Айриш кофе,Irish Coffee
upgrade.25.description,124824842240,使热咖啡鸡尾酒的收益乘以{0}。,Multiplies profit from hot coffee cocktails by {0}.,Multiplie les gains des cocktails chauds au café de {0}.,Multipliziert den Gewinn von heiße Kaffee-Cocktails um {0}.,गरम कॉफी कॉकटेल की कमाई {0} बढ़ाता है।,Moltiplica i guadagni dei cocktail caldi al caffè di {0}.,Multiplica os ganhos de drinks quentes com café em {0}.,Умножает доход от горячих кофейных коктейлей на {0}.,Multiplica las ganancias de cócteles calientes con café en {0}.
upgrade.25.value,126703890432,热咖啡鸡尾酒可获得{0},hot coffee cocktails earn {0},Les cocktails chauds au café rapportent {0},heiße Kaffee-Cocktails bringen {0} ein,गरम कॉफी कॉकटेल से {0} मिलते हैं,I cocktail caldi al caffè rendono {0},drinks quentes com café rendem {0},горячих кофейных коктейлей приносят {0},cócteles calientes con café generan {0}
upgrade.acquire,183334582087680,购入,Acquire,Acquérir,Erwerben,प्राप्त करें,Acquista,Adquirir,Приобрести,Adquirir
