Key,Id,Chinese (Simplified)(zh-Hans),English (United States)(en-US),French (France)(fr-FR),German (Germany)(de-DE),Hindi (India)(hi-IN),Italian (Italy)(it-IT),Portuguese (Brazil)(pt-BR),Russian (Russia)(ru-RU),Spanish (Spain)(es-ES)
upgrade.0.title,233317988208640,涡轮吸管,Turbo Straw,Paille Turbo,Turbo-Strohhalm,टर्बो स्ट्रॉ,Cannuccia Turbo,Canudo Turbo,Турбо-трубочка,Pajita Turbo
upgrade.0.description,233336124379136,每次手动卖出 drink 的利润提高 {0}。,Increases profit per manual drink by {0}.,Augmente le profit par boisson manuelle de {0}.,Erhöht den Gewinn pro manuellem Drink um {0}.,हर मैनुअल ड्रिंक की कमाई {0} बढ़ाता है।,Aumenta il profitto per drink manuale di {0}.,Aumenta o lucro por drink manual em {0}.,Увеличивает прибыль за ручной напиток на {0}.,Aumenta la ganancia por bebida manual en {0}.
upgrade.0.value,233336891936768,手动 drink 收益 {0},Manual drink earns {0},Le drink manuel rapporte {0},Manueller Drink bringt {0},मैनुअल ड्रिंक से {0} मिलते हैं,Il drink manuale rende {0},Drink manual rende {0},Ручной drink приносит {0},La bebida manual genera {0}
upgrade.1.title,233337642717184,饮品机,Drink Machine,Machine à Drinks,Drink-Maschine,ड्रिंक मशीन,Macchina per Drink,Máquina de Drinks,Машина для drinks,Máquina de Drinks
upgrade.1.description,233338385108992,自动 drinks 利润提高 {0}。,Multiplies automatic drink profit by {0}.,Multiplie le profit automatique des drinks de {0}.,Multipliziert den automatischen Drink-Gewinn um {0}.,ऑटो ड्रिंक की कमाई {0} बढ़ाता है।,Moltiplica il profitto automatico dei drink di {0}.,Multiplica o lucro automático de drinks em {0}.,Умножает автоматическую прибыль от drinks на {0}.,Multiplica la ganancia automática de drinks en {0}.
upgrade.1.value,233339106529280,自动 drinks 收益 {0},Auto drinks earn {0},Les auto drinks rapportent {0},Auto-Drinks bringen {0},ऑटो ड्रिंक से {0} मिलते हैं,Gli auto drink rendono {0},Auto drinks rendem {0},Авто drinks приносят {0},Los auto drinks generan {0}
upgrade.2.title,233339874086912,招牌配方,House Recipe,Recette Maison,Hausrezept,हाउस रेसिपी,Ricetta della Casa,Receita da Casa,Фирменный рецепт,Receta de la Casa
upgrade.2.description,233340624867328,每次点击卖出的 drinks 提高 {0}。,Multiplies drinks sold per click by {0}.,Multiplie les drinks vendus par clic de {0}.,Multipliziert die pro Klick verkauften Drinks um {0}.,क्लिक पर बिकने वाले ड्रिंक {0} बढ़ते हैं।,Moltiplica i drink venduti per clic di {0}.,Multiplica os drinks vendidos no clique em {0}.,"Умножает drinks, проданные за клик, на {0}.",Multiplica los drinks vendidos por clic en {0}.
upgrade.2.value,233341392424960,手动 drink 收益 {0},Manual drink earns {0},Le drink manuel rapporte {0},Manueller Drink bringt {0},मैनुअल ड्रिंक से {0} मिलते हैं,Il drink manuale rende {0},Drink manual rende {0},Ручной drink приносит {0},La bebida manual genera {0}
upgrade.3.title,233342159982592,冰镇配送,Cold Delivery,Livraison Glacée,Kalte Lieferung,कोल्ड डिलीवरी,Consegna Ghiacciata,Entrega Gelada,Ледяная доставка,Entrega Helada
upgrade.3.description,233342923345920,自动 drinks 提高 {0}。,Multiplies automatic drinks by {0}.,Multiplie les drinks automatiques de {0}.,Multipliziert automatische Drinks um {0}.,ऑटो ड्रिंक {0} बढ़ते हैं।,Moltiplica i drink automatici di {0}.,Multiplica os drinks automáticos em {0}.,Умножает автоматические drinks на {0}.,Multiplica los drinks automáticos en {0}.
upgrade.3.value,233343686709248,自动 drinks 收益 {0},Auto drinks earn {0},Les auto drinks rapportent {0},Auto-Drinks bringen {0},ऑटो ड्रिंक से {0} मिलते हैं,Gli auto drink rendono {0},Auto drinks rendem {0},Авто drinks приносят {0},Los auto drinks generan {0}
upgrade.4.title,233344441683968,贵宾菜单,VIP Menu,Menu VIP,VIP-Menü,वीआईपी मेन्यू,Menù VIP,Cardápio VIP,VIP-меню,Menú VIP
upgrade.4.description,233345146327040,每个手动 drink 提升 {0}。,Boosts each manual drink by {0}.,Améliore chaque drink manuel de {0}.,Steigert jeden manuellen Drink um {0}.,हर मैनुअल ड्रिंक को {0} बढ़ाता है।,Potenzia ogni drink manuale di {0}.,Valoriza cada drink manual em {0}.,Усиливает каждый ручной drink на {0}.,Potencia cada bebida manual en {0}.
upgrade.4.value,233345909690368,手动 drink 收益 {0},Manual drink earns {0},Le drink manuel rapporte {0},Manueller Drink bringt {0},मैनुअल ड्रिंक से {0} मिलते हैं,Il drink manuale rende {0},Drink manual rende {0},Ручной drink приносит {0},La bebida manual genera {0}
upgrade.5.title,233346626916352,自动连锁,Auto Franchise,Franchise Automatique,Automatik-Franchise,ऑटो फ्रैंचाइज़,Franchigia Automatica,Franquia Automática,Авто-франшиза,Franquicia Automática
upgrade.5.description,233347440611328,自动 drinks 收入提高 {0}。,Expands automatic drink income by {0}.,Développe le revenu automatique des drinks de {0}.,Erweitert das automatische Drink-Einkommen um {0}.,ऑटो ड्रिंक आय {0} बढ़ाता है।,Espande il reddito automatico dei drink di {0}.,Expande a renda automática de drinks em {0}.,Расширяет автоматический доход от drinks на {0}.,Expande los ingresos automáticos de drinks en {0}.
upgrade.5.value,233348153643008,自动 drinks 收益 {0},Auto drinks earn {0},Les auto drinks rapportent {0},Auto-Drinks bringen {0},ऑटो ड्रिंक से {0} मिलते हैं,Gli auto drink rendono {0},Auto drinks rendem {0},Авто drinks приносят {0},Los auto drinks generan {0}
upgrade.6.title,233348866674688,莫吉托,Mojito,Mojito,Mojito,मोजिटो,Mojito,Mojito,Мохито,Mojito
upgrade.6.description,233349600677888,使朗姆薄荷类饮品的收益乘以{0}。,Multiplies profit from rum-and-mint drinks by {0}.,Multiplie les gains des cocktails au rhum et à la menthe de {0}.,Multipliziert den Gewinn von Rum- und Minzdrinks um {0}.,रम और पुदीना ड्रिंक्स की कमाई {0} बढ़ाता है।,Moltiplica i guadagni dei drink al rum e menta di {0}.,Multiplica os ganhos de drinks com rum e hortelã em {0}.,Умножает доход от напитков с ромом и мятой на {0}.,Multiplica las ganancias de drinks de ron y menta en {0}.
upgrade.6.value,233350351458304,朗姆薄荷类饮品可获得{0},rum-and-mint drinks earn {0},Les cocktails au rhum et à la menthe rapportent {0},Rum- und Minzdrinks bringen {0} ein,रम और पुदीना ड्रिंक्स से {0} मिलते हैं,I drink al rum e menta rendono {0},drinks com rum e hortelã rendem {0},напитков с ромом и мятой приносят {0},drinks de ron y menta generan {0}
upgrade.7.title,233351077072896,玛格丽塔,Margarita,Margarita,Margarita,मार्गरीटा,Margarita,Margarita,Маргарита,Margarita
upgrade.7.description,233351811076096,使龙舌兰柑橘类饮品的收益乘以{0}。,Multiplies profit from tequila-and-citrus drinks by {0}.,Multiplie les gains des cocktails à la tequila et aux agrumes de {0}.,Multipliziert den Gewinn von Tequila- und Zitrusdrinks um {0}.,टकीला और सिट्रस ड्रिंक्स की कमाई {0} बढ़ाता है।,Moltiplica i guadagni dei drink a base di tequila e agrumi di {0}.,Multiplica os ganhos de drinks com tequila e cítricos em {0}.,Умножает доход от напитков с текилой и цитрусами на {0}.,Multiplica las ganancias de drinks de tequila y cítricos en {0}.
upgrade.7.value,233352570245120,龙舌兰柑橘类饮品可获得{0},tequila-and-citrus drinks earn {0},Les cocktails à la tequila et aux agrumes rapportent {0},Tequila- und Zitrusdrinks bringen {0} ein,टकीला और सिट्रस ड्रिंक्स से {0} मिलते हैं,I drink a base di tequila e agrumi rendono {0},drinks com tequila e cítricos rendem {0},напитков с текилой и цитрусами приносят {0},drinks de tequila y cítricos generan {0}
upgrade.8.title,233353329414144,马天尼,Martini,Martini,Martini,मार्टिनी,Martini,Martini,Мартини,Martini
upgrade.8.description,233354076000256,使干型金酒饮品的收益乘以{0}。,Multiplies profit from dry gin drinks by {0}.,Multiplie les gains des cocktails secs au gin de {0}.,Multipliziert den Gewinn von trockene Gin-Drinks um {0}.,ड्राई जिन ड्रिंक्स की कमाई {0} बढ़ाता है।,Moltiplica i guadagni dei drink secchi al gin di {0}.,Multiplica os ganhos de drinks secos com gin em {0}.,Умножает доход от сухих джиновых напитков на {0}.,Multiplica las ganancias de drinks secos con ginebra en {0}.
upgrade.8.value,233354864529408,干型金酒饮品可获得{0},dry gin drinks earn {0},Les cocktails secs au gin rapportent {0},trockene Gin-Drinks bringen {0} ein,ड्राई जिन ड्रिंक्स से {0} मिलते हैं,I drink secchi al gin rendono {0},drinks secos com gin rendem {0},сухих джиновых напитков приносят {0},drinks secos con ginebra generan {0}
upgrade.9.title,233355640475648,古典鸡尾酒,Old Fashioned,Old Fashioned,Old Fashioned,ओल्ड फैशन्ड,Old Fashioned,Old Fashioned,Олд-фэшенд,Old Fashioned
upgrade.9.description,233356399644672,使经典威士忌饮品的收益乘以{0}。,Multiplies profit from classic whiskey drinks by {0}.,Multiplie les gains des cocktails classiques au whiskey de {0}.,Multipliziert den Gewinn von klassische Whiskeydrinks um {0}.,क्लासिक व्हिस्की ड्रिंक्स की कमाई {0} बढ़ाता है।,Moltiplica i guadagni dei drink classici al whiskey di {0}.,Multiplica os ganhos de drinks clássicos com whiskey em {0}.,Умножает доход от классических напитков с виски на {0}.,Multiplica las ganancias de drinks clásicos con whiskey en {0}.
upgrade.9.value,233357200756736,经典威士忌饮品可获得{0},classic whiskey drinks earn {0},Les cocktails classiques au whiskey rapportent {0},klassische Whiskeydrinks bringen {0} ein,क्लासिक व्हिस्की ड्रिंक्स से {0} मिलते हैं,I drink classici al whiskey rendono {0},drinks clássicos com whiskey rendem {0},классических напитков с виски приносят {0},drinks clásicos con whiskey generan {0}
upgrade.10.title,233357964120064,内格罗尼,Negroni,Negroni,Negroni,नेग्रोनी,Negroni,Negroni,Негрони,Negroni
upgrade.10.description,233358723289088,使苦味草本类饮品的收益乘以{0}。,Multiplies profit from bitter herbal drinks by {0}.,Multiplie les gains des cocktails amers et herbacés de {0}.,Multipliziert den Gewinn von bittere Kräuterdrinks um {0}.,कड़वे हर्बल ड्रिंक्स की कमाई {0} बढ़ाता है।,Moltiplica i guadagni dei drink amari ed erbacei di {0}.,Multiplica os ganhos de drinks amargos e herbais em {0}.,Умножает доход от горьких травяных напитков на {0}.,Multiplica las ganancias de drinks amargos y herbales en {0}.
upgrade.10.value,233359461486592,苦味草本类饮品可获得{0},bitter herbal drinks earn {0},Les cocktails amers et herbacés rapportent {0},bittere Kräuterdrinks bringen {0} ein,कड़वे हर्बल ड्रिंक्स से {0} मिलते हैं,I drink amari ed erbacei rendono {0},drinks amargos e herbais rendem {0},горьких травяных напитков приносят {0},drinks amargos y herbales generan {0}
upgrade.11.title,233360254210048,代基里,Daiquiri,Daiquiri,Daiquiri,डायक्विरी,Daiquiri,Daiquiri,Дайкири,Daiquiri
upgrade.11.description,233360916910080,使朗姆青柠类饮品的收益乘以{0}。,Multiplies profit from rum-and-lime drinks by {0}.,Multiplie les gains des cocktails au rhum et au citron vert de {0}.,Multipliziert den Gewinn von Rum- und Limettendrinks um {0}.,रम और नींबू ड्रिंक्स की कमाई {0} बढ़ाता है।,Moltiplica i guadagni dei drink al rum e lime di {0}.,Multiplica os ganhos de drinks de rum e limão em {0}.,Умножает доход от напитков с ромом и лаймом на {0}.,Multiplica las ganancias de drinks de ron y lima en {0}.
upgrade.11.value,86849613824,朗姆青柠类饮品可获得{0},rum-and-lime drinks earn {0},Les cocktails au rhum et au citron vert rapportent {0},Rum- und Limettendrinks bringen {0} ein,रम और नींबू ड्रिंक्स से {0} मिलते हैं,I drink al rum e lime rendono {0},drinks de rum e limão rendem {0},напитков с ромом и лаймом приносят {0},drinks de ron y lima generan {0}
upgrade.12.title,87684280320,凯匹林纳,Caipirinha,Caipirinha,Caipirinha,कैपिरिन्हा,Caipirinha,Caipirinha,Кайпиринья,Caipirinha
upgrade.12.description,88518946816,使卡莎萨青柠类饮品的收益乘以{0}。,Multiplies profit from cachaça-and-lime drinks by {0}.,Multiplie les gains des cocktails à la cachaça et au citron vert de {0}.,Multipliziert den Gewinn von Cachaça- und Limettendrinks um {0}.,कशासा और नींबू ड्रिंक्स की कमाई {0} बढ़ाता है।,Moltiplica i guadagni dei drink alla cachaça e lime di {0}.,Multiplica os ganhos de drinks de cachaça e limão em {0}.,Умножает доход от напитков с кашасой и лаймом на {0}.,Multiplica las ganancias de drinks de cachaça y lima en {0}.
upgrade.12.value,89395556352,卡莎萨青柠类饮品可获得{0},cachaça-and-lime drinks earn {0},Les cocktails à la cachaça et au citron vert rapportent {0},Cachaça- und Limettendrinks bringen {0} ein,कशासा और नींबू ड्रिंक्स से {0} मिलते हैं,I drink alla cachaça e lime rendono {0},drinks de cachaça e limão rendem {0},напитков с кашасой и лаймом приносят {0},drinks de cachaça y lima generan {0}
upgrade.13.title,90267971584,椰林飘香,Piña Colada,Piña Colada,Piña Colada,पिना कोलाडा,Piña Colada,Piña Colada,Пина колада,Piña Colada
upgrade.13.description,91111026688,使热带奶香类饮品的收益乘以{0}。,Multiplies profit from tropical creamy drinks by {0}.,Multiplie les gains des cocktails tropicaux et crémeux de {0}.,Multipliziert den Gewinn von tropische cremige Drinks um {0}.,ट्रॉपिकल क्रीमी ड्रिंक्स की कमाई {0} बढ़ाता है।,Moltiplica i guadagni dei drink tropicali e cremosi di {0}.,Multiplica os ganhos de drinks tropicais e cremosos em {0}.,Умножает доход от тропических сливочных напитков на {0}.,Multiplica las ganancias de drinks tropicales y cremosos en {0}.
upgrade.13.value,92016996352,热带奶香类饮品可获得{0},tropical creamy drinks earn {0},Les cocktails tropicaux et crémeux rapportent {0},tropische cremige Drinks bringen {0} ein,ट्रॉपिकल क्रीमी ड्रिंक्स से {0} मिलते हैं,I drink tropicali e cremosi rendono {0},drinks tropicais e cremosos rendem {0},тропических сливочных напитков приносят {0},drinks tropicales y cremosos generan {0}
upgrade.14.title,92851662848,大都会,Cosmopolitan,Cosmopolitan,Cosmopolitan,कॉस्मोपॉलिटन,Cosmopolitan,Cosmopolitan,Космополитен,Cosmopolitan
upgrade.14.description,93694717952,使伏特加莓果柑橘类饮品的收益乘以{0}。,"Multiplies profit from vodka, berry, and citrus drinks by {0}.","Multiplie les gains des cocktails à la vodka, fruits rouges et agrumes de {0}.","Multipliziert den Gewinn von Wodka-, Beeren- und Zitrusdrinks um {0}.","वोडका, बेरी और सिट्रस ड्रिंक्स की कमाई {0} बढ़ाता है।","Moltiplica i guadagni dei drink con vodka, frutti rossi e agrumi di {0}.","Multiplica os ganhos de drinks de vodka, frutas vermelhas e cítricos em {0}.","Умножает доход от напитков с водкой, ягодами и цитрусами на {0}.","Multiplica las ganancias de drinks de vodka, frutos rojos y cítricos en {0}."
upgrade.14.value,94495830016,伏特加莓果柑橘类饮品可获得{0},"vodka, berry, and citrus drinks earn {0}","Les cocktails à la vodka, fruits rouges et agrumes rapportent {0}","Wodka-, Beeren- und Zitrusdrinks bringen {0} ein","वोडका, बेरी और सिट्रस ड्रिंक्स से {0} मिलते हैं","I drink con vodka, frutti rossi e agrumi rendono {0}","drinks de vodka, frutas vermelhas e cítricos rendem {0}","напитков с водкой, ягодами и цитрусами приносят {0}","drinks de vodka, frutos rojos y cítricos generan {0}"
upgrade.15.title,95372439552,血腥玛丽,Bloody Mary,Bloody Mary,Bloody Mary,ब्लडी मैरी,Bloody Mary,Bloody Mary,Блади Мэри,Bloody Mary
upgrade.15.description,96211300352,使香辛早午餐类饮品的收益乘以{0}。,Multiplies profit from spiced brunch drinks by {0}.,Multiplie les gains des cocktails épicés de brunch de {0}.,Multipliziert den Gewinn von würzige Brunch-Drinks um {0}.,स्पाइसी ब्रंच ड्रिंक्स की कमाई {0} बढ़ाता है।,Moltiplica i guadagni dei drink speziati da brunch di {0}.,Multiplica os ganhos de drinks apimentados de brunch em {0}.,Умножает доход от пряных бранч-коктейлей на {0}.,Multiplica las ganancias de drinks especiados de brunch en {0}.
upgrade.15.value,97075326976,香辛早午餐类饮品可获得{0},spiced brunch drinks earn {0},Les cocktails épicés de brunch rapportent {0},würzige Brunch-Drinks bringen {0} ein,स्पाइसी ब्रंच ड्रिंक्स से {0} मिलते हैं,I drink speziati da brunch rendono {0},drinks apimentados de brunch rendem {0},пряных бранч-коктейлей приносят {0},drinks especiados de brunch generan {0}
upgrade.16.title,97918382080,莫斯科骡子,Moscow Mule,Moscow Mule,Moscow Mule,मॉस्को म्यूल,Moscow Mule,Moscow Mule,Московский мул,Moscow Mule
upgrade.16.description,98761437184,使姜味类饮品的收益乘以{0}。,Multiplies profit from ginger drinks by {0}.,Multiplie les gains des cocktails au gingembre de {0}.,Multipliziert den Gewinn von Ingwerdrinks um {0}.,अदरक वाले ड्रिंक्स की कमाई {0} बढ़ाता है।,Moltiplica i guadagni dei drink allo zenzero di {0}.,Multiplica os ganhos de drinks com gengibre em {0}.,Умножает доход от напитков с имбирём на {0}.,Multiplica las ganancias de drinks con jengibre en {0}.
upgrade.16.value,99596103680,姜味类饮品可获得{0},ginger drinks earn {0},Les cocktails au gingembre rapportent {0},Ingwerdrinks bringen {0} ein,अदरक वाले ड्रिंक्स से {0} मिलते हैं,I drink allo zenzero rendono {0},drinks com gengibre rendem {0},напитков с имбирём приносят {0},drinks con jengibre generan {0}
upgrade.17.title,100430770176,迈泰,Mai Tai,Mai Tai,Mai Tai,माई टाई,Mai Tai,Mai Tai,Май Тай,Mai Tai
upgrade.17.description,101269630976,使提基朗姆类饮品的收益乘以{0}。,Multiplies profit from tiki rum drinks by {0}.,Multiplie les gains des cocktails tiki au rhum de {0}.,Multipliziert den Gewinn von Tiki-Rum-Drinks um {0}.,टिकी रम ड्रिंक्स की कमाई {0} बढ़ाता है।,Moltiplica i guadagni dei drink tiki al rum di {0}.,Multiplica os ganhos de drinks tiki com rum em {0}.,Умножает доход от тики-напитков с ромом на {0}.,Multiplica las ganancias de drinks tiki con ron en {0}.
upgrade.17.value,102179794944,提基朗姆类饮品可获得{0},tiki rum drinks earn {0},Les cocktails tiki au rhum rapportent {0},Tiki-Rum-Drinks bringen {0} ein,टिकी रम ड्रिंक्स से {0} मिलते हैं,I drink tiki al rum rendono {0},drinks tiki com rum rendem {0},тики-напитков с ромом приносят {0},drinks tiki con ron generan {0}
upgrade.18.title,103022850048,贝里尼,Bellini,Bellini,Bellini,बेलिनी,Bellini,Bellini,Беллини,Bellini
upgrade.18.description,103853322240,使水果起泡类饮品的收益乘以{0}。,Multiplies profit from sparkling fruit drinks by {0}.,Multiplie les gains des cocktails fruités au vin effervescent de {0}.,Multipliziert den Gewinn von fruchtige Schaumwein-Drinks um {0}.,स्पार्कलिंग फ्रूट ड्रिंक्स की कमाई {0} बढ़ाता है।,Moltiplica i guadagni dei drink fruttati con spumante di {0}.,Multiplica os ganhos de drinks espumantes com frutas em {0}.,Умножает доход от игристых фруктовых напитков на {0}.,Multiplica las ganancias de drinks espumosos con fruta en {0}.
upgrade.18.value,104725737472,水果起泡类饮品可获得{0},sparkling fruit drinks earn {0},Les cocktails fruités au vin effervescent rapportent {0},fruchtige Schaumwein-Drinks bringen {0} ein,स्पार्कलिंग फ्रूट ड्रिंक्स से {0} मिलते हैं,I drink fruttati con spumante rendono {0},drinks espumantes com frutas rendem {0},игристых фруктовых напитков приносят {0},drinks espumosos con fruta generan {0}
upgrade.19.title,105606541312,含羞草鸡尾酒,Mimosa,Mimosa,Mimosa,मिमोसा,Mimosa,Mimosa,Мимоза,Mimosa
upgrade.19.description,106445402112,使清爽果汁起泡类饮品的收益乘以{0}。,Multiplies profit from light sparkling juice drinks by {0}.,Multiplie les gains des cocktails légers au mousseux et au jus de {0}.,Multipliziert den Gewinn von leichte Sekt-Saft-Drinks um {0}.,हल्के स्पार्कलिंग जूस ड्रिंक्स की कमाई {0} बढ़ाता है।,Moltiplica i guadagni dei drink leggeri con spumante e succo di {0}.,Multiplica os ganhos de drinks leves com espumante e suco em {0}.,Умножает доход от лёгких напитков с игристым и соком на {0}.,Multiplica las ganancias de drinks ligeros con espumoso y zumo en {0}.
upgrade.19.value,107313623040,清爽果汁起泡类饮品可获得{0},light sparkling juice drinks earn {0},Les cocktails légers au mousseux et au jus rapportent {0},leichte Sekt-Saft-Drinks bringen {0} ein,हल्के स्पार्कलिंग जूस ड्रिंक्स से {0} मिलते हैं,I drink leggeri con spumante e succo rendono {0},drinks leves com espumante e suco rendem {0},лёгких напитков с игристым и соком приносят {0},drinks ligeros con espumoso y zumo generan {0}
upgrade.20.title,108118929408,曼哈顿,Manhattan,Manhattan,Manhattan,मैनहैटन,Manhattan,Manhattan,Манхэттен,Manhattan
upgrade.20.description,109058453504,使醇厚威士忌苦艾类饮品的收益乘以{0}。,Multiplies profit from full-bodied whiskey-and-vermouth drinks by {0}.,Multiplie les gains des cocktails corsés au whiskey et au vermouth de {0}.,Multipliziert den Gewinn von kräftige Whiskey- und Wermutdrinks um {0}.,रिच व्हिस्की और वर्मुथ ड्रिंक्स की कमाई {0} बढ़ाता है।,Moltiplica i guadagni dei drink corposi con whiskey e vermouth di {0}.,Multiplica os ganhos de drinks encorpados com whiskey e vermute em {0}.,Умножает доход от насыщенных напитков с виски и вермутом на {0}.,Multiplica las ganancias de drinks con cuerpo de whiskey y vermut en {0}.
upgrade.20.value,109897314304,醇厚威士忌苦艾类饮品可获得{0},full-bodied whiskey-and-vermouth drinks earn {0},Les cocktails corsés au whiskey et au vermouth rapportent {0},kräftige Whiskey- und Wermutdrinks bringen {0} ein,रिच व्हिस्की और वर्मुथ ड्रिंक्स से {0} मिलते हैं,I drink corposi con whiskey e vermouth rendono {0},drinks encorpados com whiskey e vermute rendem {0},насыщенных напитков с виски и вермутом приносят {0},drinks con cuerpo de whiskey y vermut generan {0}
